Subject,Session ID,Thought Leadership Title,Thought Leadership Themes,Thought Leadership Audience,Thought Leadership Value,Speaker Spotlight Angle,Speaker Spotlight Targets,Speaker Spotlight Value,Trend Analysis Topic,Trend Analysis Components,Trend Analysis Value,Event Positioning Angle,Event Positioning Distribution,Event Positioning Value,Coverage Priority,Coverage Rationale,Error
"day3-main-005|||Tech, Trust & Transformation: The New Broker Playbook|||CRM, AI tools, and behavioral insights for stronger client loyalty. Operational transformation of traditional brokers with technology enablement.",day3-main-005,"The AI-Powered Broker: Tech, Trust, and the New Playbook for Client Loyalty","AI in Real Estate Brokerage, CRM for Client Loyalty, Behavioral Insights in PropTech, Operational Transformation of Brokerages, Future of the Real Estate Agent","Real estate brokerage owners, managing partners, PropTech investors, and senior technology officers (CTOs/CIOs) in the real estate sector.","High SEO value for key terms like ""AI real estate"" and ""broker transformation."" Establishes RealTimes as a thought leader in the future of brokerage, attracting a senior, decision-making audience.","""The Human-AI Hybrid: How Behavioral Science and Tech are Re-defining the Broker's Value Proposition."" Focus on the shift from transactional sales to relationship-driven advisory, powered by data.","[Speaker 1 Name], [Speaker 2 Name], [Speaker 3 Name]","Establishes direct relationships with influential brokerage leaders and PropTech founders, providing exclusive content that enhances RealTimes' authority and network within the high-level B2B segment.",The 'Invisible Broker': How Predictive Behavioral AI is Automating Loyalty and Re-shaping the Agent's Role,"Global CRM adoption rates in real estate, comparative analysis of AI tools for lead scoring vs. client retention, case studies of brokerages successfully integrating behavioral economics, 5-year forecast for agent-to-tech ratio.","Creates a high-authority, data-driven asset that can be gated for lead generation. Provides a forward-looking perspective that positions RealTimes ahead of competitors and drives long-term organic traffic.","The session is a crucial guide for traditional real estate brokerages on how to survive and thrive in the age of AI and PropTech, moving beyond fear to strategic adoption. It frames technology not as a replacement, but as the ultimate enablement tool for the human-centric broker.","Promote heavily across LinkedIn and industry newsletters targeting brokerage owners and managing partners. Create a short, punchy video trailer for Instagram/TikTok featuring key quotes about ""The New Broker Playbook."" Post-event, host a webinar summarizing the key takeaways.","Positions RealTimes as the essential resource for brokerage leadership navigating digital transformation, driving high-quality B2B engagement and demonstrating a deep understanding of industry pain points.",Very High,"This session addresses the critical and timely topic of technology-driven transformation for traditional real estate brokers, which is a core interest for the PropTech audience. The focus on AI, CRM, and behavioral insights provides high-value, actionable content.",
"day3-main-006|||Green Deals & Grand Designs: Investing in Vision|||How sustainability meets design excellence and investor trust. Premium sustainable development, carbon-neutral buildings, and their investment appeal.",day3-main-006,The Green Premium: Why Carbon-Neutral Luxury is the Next Investment Frontier,"Sustainable investment, carbon-neutral buildings, premium real estate design, ESG compliance, long-term asset value, green financing","Institutional investors, private equity firms, high-net-worth individuals (HNWIs), and luxury real estate developers.","Captures high-intent search traffic from investors researching ESG and sustainable finance, positioning RealTimes as a key resource for actionable investment intelligence.","""The Carbon-Neutral ROI"": How to quantify the long-term financial benefits and risk mitigation of premium sustainable design choices in a volatile market.","Chief Sustainability Officer of a major developer, Head of ESG Investment at a global asset manager, Architect specializing in carbon-neutral luxury design","Secures high-level interviews with influential industry figures, deepening relationships for future exclusive content and positioning RealTimes as a key media partner for thought leaders.",The 'Stranded Asset' Risk: Modeling the Future Devaluation of Non-Sustainable Premium Real Estate,"Global regulatory changes (EU Taxonomy, SEC climate rules), proprietary data on ""green premium"" vs. standard assets, case studies of successful carbon-neutral developments, analysis of green bond market for real estate","Provides a unique, data-driven perspective that elevates RealTimes' authority, offering a critical, forward-looking analysis that is essential for long-term strategic planning by industry leaders.",Beyond Greenwashing: The Financial Imperative of Carbon-Neutral Luxury Real Estate,Targeted email campaign to institutional investors and UHNWIs; dedicated social media push on LinkedIn and X; feature placement on the RealTimes homepage during the event.,"Establishes RealTimes as the authoritative source on high-stakes, high-return sustainable investment, driving premium traffic and demonstrating value to high-net-worth advertisers.",Very High,"This session addresses the critical intersection of sustainability, premium design, and investment returns, which is a top-tier topic for PropTech media and high-value investors.",
"day3-main-007|||The Human Edge: Buyer Behavior & Relationship Mastery|||Examines psychology and emotional intelligence in real estate. Buyer behavior insights, relationship management, and sales psychology for high-value transactions.",day3-main-007,The Psychology of Property: Mastering Buyer Emotion for High-Value Sales,"Real Estate Psychology, Buyer Behavior, Emotional Intelligence, Sales Mastery, High-Value Transactions","Senior real estate brokers, luxury property developers, sales directors, and PropTech innovators focused on client-facing solutions.","Establishes RealTimes as a source for advanced sales strategy, attracting a high-value audience and generating strong organic search traffic from sales professionals.","""The Unspoken Deal: How Emotional Intelligence is the Newest PropTech Tool"" - focusing on the speaker's personal journey and specific techniques for leveraging EQ in a data-driven market.","Dr. Anya Sharma, Marcus Chen","Provides actionable, personal insights from industry leaders, building a connection with the audience and generating buzz for the session's practical takeaways.",The Neuro-Economics of Real Estate: Predicting Buyer Decisions in a Volatile Market,"Analysis of global real estate transaction data, psychological studies on high-net-worth individuals, case studies of AI-driven client profiling tools, expert interviews on sales team training.","Positions RealTimes as a thought leader by connecting soft skills (psychology) with hard data (neuro-economics), offering a unique, forward-looking perspective on market behavior.",Position the session as the essential guide to future-proofing sales teams against technological disruption by focusing on irreplaceable human skills.,"Promote via a dedicated email campaign to sales and brokerage lists, targeted LinkedIn ads, and a featured spot in the 'Must-Attend Sessions for Sales Leaders' event guide.","Highlights RealTimes' commitment to covering both tech and the essential human element of PropTech, driving registration from key sales and leadership demographics.",High,"This session addresses the timeless, high-impact topic of human psychology in sales, which is critical for high-value transactions and provides evergreen content value.",
"day3-main-008|||Real Estate 2033: The Future Is Now|||Visionaries share foresight on markets, sustainability, and AI-driven growth. Forward-looking summary and vision for the future of real estate.",day3-main-008,"The 2033 Real Estate Blueprint: AI, ESG, and the Next Decade of Growth","Real Estate 2033, AI in Property, ESG Investment, Future Market Structure, PropTech Innovation","Institutional investors, C-suite executives of major development firms, and PropTech founders seeking a 10-year strategic outlook.","Captures high-intent search traffic for 'future of real estate' and '2033 predictions,' positioning RealTimes as a thought leader and driving early event registration interest among strategic decision-makers.","How does a long-term, 10-year vision for real estate investment and development differ from current 1-3 year strategies, and what is the single biggest risk to achieving the 2033 vision?","[Target Speaker 1 Name], [Target Speaker 2 Name], [Target Speaker 3 Name]","Secures high-level quotes and exclusive insights from industry visionaries, deepening relationships with key opinion leaders and providing content that is instantly quotable and shareable by C-suite executives.",The Convergence of Generative AI and Sustainable Design in Commercial Real Estate Development,"Global regulatory landscape analysis for AI/ESG, deep dive into venture capital funding for 'future-proof' PropTech, comparative analysis of 2023 vs. 2033 real estate asset allocation models","Creates a high-authority, data-driven piece that serves as a benchmark report, generating backlinks and establishing RealTimes as the go-to source for the intersection of technology and sustainability in property.","This session is the definitive roadmap for the next decade, moving beyond current trends to establish the foundational shifts in market structure, technology adoption, and ethical investment that will define real estate by 2033.","Promote heavily across all channels (LinkedIn, X, Newsletter) with a 3-part video series featuring soundbites from the session. Target industry analysts and institutional investors directly via a dedicated email campaign.","Establishes RealTimes as the authoritative source for long-term strategic thinking and future-proofing, attracting high-value, visionary readership and demonstrating media partnership value by driving attendance to a marquee session.",Very High,"This main-stage session sets the forward-looking agenda for the entire industry, directly addressing the most critical and high-impact themes of the next decade: AI, sustainability, and market evolution.",
"day3-institutional-001|||Liquidity Lab: Global Money Markets & FX Strategies|||Optimizing multi-currency liquidity across jurisdictions. Foreign exchange hedging, currency risk management, and global liquidity optimization for institutional investors.",day3-institutional-001,Mastering Multi-Currency Liquidity: FX Strategies for Global Real Estate Investors,"Cross-border liquidity, FX hedging strategies, multi-currency risk management, institutional capital flows","Institutional real estate investors, fund managers, treasury and finance directors, and PropTech founders focused on cross-border transactions.",High SEO potential for long-tail finance keywords; establishes RealTimes as a thought leader in institutional real estate finance ahead of the event.,"""Beyond the Hedge: How are institutional investors using advanced FX derivatives and on-chain solutions to achieve alpha in volatile global real estate markets?""","Global Head of Treasury, Chief Investment Officer, Head of Institutional FX Strategy","Secures high-level executive interviews, building direct relationships with key decision-makers in institutional finance and providing exclusive, high-authority content.",The Tokenization of Liquidity: How DeFi and DLT are Reshaping Institutional FX and Capital Movement in Real Estate,"Analysis of 2025-2026 central bank rate forecasts, correlation study of sovereign debt and real estate FX volatility, deep dive into tokenized real estate liquidity pools","Generates highly authoritative, forward-looking content that attracts a sophisticated audience and provides a unique, future-focused perspective on a core finance topic.","The definitive guide to navigating the new era of global real estate finance, focusing on the hidden costs and opportunities in multi-jurisdictional capital flows.",Targeted email campaign to RealTimes institutional investor database; LinkedIn campaign focused on finance and treasury professionals; dedicated feature on the RealTimes homepage finance vertical.,"Positions RealTimes as the essential source for complex institutional finance topics, driving high-value traffic and strengthening our relationship with the event organizer by highlighting a key institutional track session.",Very High,"This session addresses the critical, high-value challenge of cross-border liquidity and FX risk, which is central to institutional real estate investment and offers deep, actionable insights for our core audience.",
day3-institutional-002|||Sustainable Yield Forum: Green Bonds & ESG Returns|||Explores green bonds and ESG-linked instruments for sustainable profitability. Performance of ESG-focused real estate funds; sustainable yield strategies.,,,,,,,,,,,,,,,,,
day3-institutional-003|||AI & Quant Capital: Smart Underwriting & Alpha Generation|||Machine-learning tools for risk modeling and institutional alpha. Quantitative approaches to real estate underwriting; AI-enhanced investment analysis.,day3-institutional-003,AI & Quant Capital: The Algorithmic Edge in Real Estate Underwriting,"AI in real estate underwriting, quantitative investment strategies, machine learning for risk modeling, alpha generation in PropTech, institutional capital deployment","Institutional investors, private equity fund managers, quantitative analysts, and real estate portfolio strategists.","Captures high-intent search traffic from institutional finance professionals researching AI applications, positioning RealTimes as the go-to source for advanced investment strategies.",The 'Black Box' Challenge: How to build trust and transparency in AI-driven underwriting models for fiduciary-level capital deployment.,"Chief Investment Officer (CIO) of a major institutional fund, Head of Quantitative Research at a PropTech VC, Senior Portfolio Manager specializing in alternative assets","Secures high-level executive interviews, deepening relationships with key decision-makers in the institutional investment space and providing exclusive, trust-building content.",The Maturation of Quant Real Estate: From Back-Testing to Live Deployment and Regulatory Scrutiny,"Comparative analysis of traditional vs. AI-driven risk metrics, case studies of successful quant real estate funds, regulatory landscape for algorithmic investment, future of human-quant collaboration","Generates authoritative, evergreen content that serves as a benchmark for industry progress, enhancing RealTimes' reputation for deep, credible market analysis.",The AI-Driven Future of Real Estate Capital: Moving Beyond Gut Feeling to Algorithmic Alpha Generation. This session is critical for institutional investors seeking a competitive edge through technology.,Targeted email campaign to RealTimes' institutional investor and fund manager database. Promotion via LinkedIn and X (Twitter) with a focus on 'Quant Real Estate' and 'AI in PropTech' hashtags. Post-event video highlight reel and executive summary for premium subscribers.,"Establishes RealTimes as the leading authority on the intersection of AI, quantitative finance, and institutional real estate, driving high-value traffic and premium subscription conversions.",Very High,"This session addresses the most disruptive trend in institutional real estate—the integration of AI and quantitative finance—offering high-value, actionable insights for capital allocators and fund managers.",
day3-institutional-004|||Networking Lunch & Investor Dialogues|||Interactive sessions between capital allocators and fund managers / investors. Facilitated introductions for capital matching.,day3-institutional-004,Institutional Capital's Next Move: PropTech Investment Strategies for 2026,"PropTech investment trends, Institutional capital allocation, Real estate fund strategies, LP/GP alignment, Emerging market opportunities","Institutional Investors (Pension Funds, Endowments, SWFs), Real Estate Private Equity Fund Managers, Capital Allocators, and Investment Consultants.","Establishes RealTimes as a leading voice in institutional PropTech investment, capturing high-intent SEO traffic from key decision-makers and generating leads for event attendance.","""The LP Perspective: What are the non-negotiables for PropTech fund investment in 2026?"" - Focusing on due diligence, ESG mandates, and return expectations.","Global Pension Fund CIOs, Sovereign Wealth Fund Representatives, Institutional Investment Consultants","Builds relationships with influential capital allocators, providing RealTimes with exclusive, high-authority content and enhancing credibility within the institutional investment community.",The Future of LP-GP Alignment: Structuring PropTech Funds for Long-Term Institutional Success,"Analysis of recent PropTech fund closures and performance, Survey of institutional investor sentiment on real estate tech, Deep dive into LP-GP fee structures and alignment models, Regulatory impact on cross-border capital flows","Creates a definitive, authoritative piece of research that can be gated for lead generation, providing a valuable resource for both LPs and GPs and cementing RealTimes' position as a market intelligence leader.",The essential nexus for PropTech capital deployment: Connecting global LPs with leading fund managers to unlock the next wave of real estate innovation.,Targeted outreach to institutional investor newsletters and private equity real estate publications. Live social media coverage with exclusive quotes from attendees. Post-event summary in a dedicated investor-focused email blast.,"Positions RealTimes as the essential media partner for institutional real estate investment, driving high-value B2B engagement and demonstrating access to top-tier capital sources.",High,"This session is a key networking and deal-making opportunity, directly addressing the core audience of capital allocators and fund managers, making it a high-value content driver.",
day3-institutional-005|||Tokenized Infrastructure & Impact Capital|||Integrating digital infrastructure and green finance models. Tokenized infrastructure projects; blending impact investing with financial returns.,day3-institutional-005,Tokenized Infrastructure: The Future of Impact Capital and Green Finance,"Tokenization of Real-World Assets (RWA), Green Finance, Impact Investing Metrics, Decentralized Autonomous Organizations (DAOs) in Infrastructure, Regulatory Sandboxes.","Institutional investors, real estate developers, asset managers, and FinTech/PropTech founders interested in sustainable finance and digital asset strategies.","Establishes RealTimes as an authority on the future of real estate finance, capturing high-intent search traffic from institutional readers researching digital asset strategies and ESG compliance.","""From Vision to Vesting: The Operational Realities of Tokenizing Green Infrastructure."" Focus on the practical challenges, regulatory hurdles, and technology stacks required to successfully launch and manage tokenized impact funds.","CEO of a major tokenization platform, Head of ESG Investing at a global asset manager, a leading PropTech venture capitalist.","Secures high-level interviews with key decision-makers, deepening relationships with influential figures in both the FinTech and Impact Investing sectors, and providing exclusive, actionable insights for our audience.",The Institutionalization of Tokenized Real-World Assets (RWA) and its Impact on Global Infrastructure Funding,"Global regulatory landscape for tokenized securities, performance comparison of tokenized vs. traditional infrastructure funds, analysis of key blockchain protocols for RWA, investor sentiment survey on impact capital.","Generates a definitive, data-driven report that serves as a benchmark for the industry, boosting RealTimes' reputation for deep, proprietary research and creating a valuable lead-generation asset.","Highlighting the convergence of blockchain technology, sustainable finance, and institutional capital as the next frontier for real estate investment and development. Focus on the 'how' of blending financial returns with measurable social/environmental impact.","Targeted outreach to institutional investors, ESG funds, and blockchain/DeFi media. Promote via a dedicated email campaign to RealTimes' capital markets and sustainability segments. Live-tweet key insights during the session.","Positions RealTimes as a thought leader at the intersection of finance, technology, and sustainability, driving high-value engagement from institutional readers and demonstrating media partner value by covering complex, high-impact topics.",Very High,This session is at the nexus of two major industry trends—tokenization and impact investing—making it highly relevant for a broad PropTech audience and a key driver of future capital flows.,
day3-institutional-006|||Global CIO Roundtable: 2033 Allocation Roadmaps|||Closed-door dialogue on strategies shaping the next decade of capital allocation. Confidential discussion of long-term institutional allocation strategies.,day3-institutional-006,The 2033 Capital Allocation Playbook: How CIOs Are Redefining Institutional Portfolios,"Long-term capital allocation, institutional investment strategies, private market evolution, geopolitical risk modeling, portfolio resilience","Institutional investors, CIOs, sovereign wealth funds, pension fund managers, private equity LPs","Establishes RealTimes as a forward-thinking authority on long-term institutional investment trends, driving high-value traffic from key decision-makers.","""Beyond the Horizon: What is the single biggest structural shift (e.g., climate, AI, deglobalization) that will fundamentally alter your portfolio's risk/return profile by 2033?""","CIOs from major sovereign wealth funds, CIOs from top 10 global pension funds, Heads of Institutional Allocation at major endowments","Facilitates direct, high-level engagement with the most influential capital allocators, creating a strong foundation for future exclusive interviews and partnership opportunities.",The Structural Erosion of the 60/40 Portfolio: Modeling the Next Decade of Institutional Asset Class Re-Weighting,"Analysis of 2023-2025 institutional allocation data, modeling of 2033-focused climate and AI impact on asset classes, deep-dive into illiquidity premium erosion and private credit growth","Generates highly authoritative, data-driven content that captures long-tail SEO for ""institutional allocation"" and ""future portfolio strategy,"" cementing RealTimes' expertise.","The definitive, confidential discussion on the next 10-year institutional capital allocation roadmaps, offering unparalleled insight into future market direction.","Exclusive email newsletter to C-suite subscribers, targeted LinkedIn campaign to institutional investors, and a dedicated, gated content hub on the RealTimes website.","Positions RealTimes as the exclusive media partner with access to the most strategic, forward-looking, and confidential discussions at IPS26, enhancing brand prestige.",Very High,"This closed-door CIO roundtable is a high-value, exclusive session that dictates the next decade of institutional capital flow, making it essential for RealTimes' authority and relationship building.",
day3-institutional-007|||Governance Equation: RegTech & Transparency in Action|||AI-powered oversight for compliance and reporting. RegTech solutions for fund governance; automated compliance and transparency frameworks.,,,,,,,,,,,,,,,,,
