Subject,Session ID,Thought Leadership Title,Thought Leadership Themes,Thought Leadership Audience,Thought Leadership Value,Speaker Spotlight Angle,Speaker Spotlight Targets,Speaker Spotlight Value,Trend Analysis Topic,Trend Analysis Components,Trend Analysis Value,Event Positioning Angle,Event Positioning Distribution,Event Positioning Value,Coverage Priority,Coverage Rationale,Error
day1-main-001|||MC Opening Remarks|||Host opening remarks and event welcome,day1-main-001,The Future of PropTech: What to Expect from IPS Congress 2026 in Dubai,"PropTech, IPS Congress 2026, Dubai, real estate innovation, event preview, global market trends","Real estate investors, PropTech founders, industry executives, media, and potential attendees.",Drives high-intent organic traffic pre-event by capturing search queries related to the congress and establishing RealTimes as a key information hub.,"A brief, high-energy interview with the host/MC focusing on the most anticipated moments and the overarching 'vibe' of the congress.","Host/MC of the opening remarks, Event Organizer Representative","Secures early, exclusive soundbites that capture the excitement and scale of the event, building rapport with key event personnel.",The Evolving Narrative of Global PropTech: A Comparative Analysis of Congress Opening Themes (2024-2026),"Analysis of host's opening script, review of past IPS opening themes, comparison with other major PropTech event launches, executive interviews on industry sentiment","Provides a deeper, historical context to the event's messaging, enhancing RealTimes' authority as a long-term industry observer.","The official launch of IPS Congress 2026, establishing the core themes and narrative for the next three days of PropTech innovation.","Live-tweet the key announcements and themes, followed by a rapid post-event summary article and inclusion in the daily email newsletter.",Maximizes immediate event relevance and positions RealTimes as the primary source for real-time congress updates and official announcements.,Very High,"As the official opening, this session sets the tone and agenda for the entire congress, making it essential for immediate, high-level coverage and event context.",
"day1-main-002|||Opening & Welcome: From Sand to Skyline|||Cinematic 6-minute journey through Dubai's rise as a real estate icon, followed by DLD opening remarks showcasing Dubai's development trajectory and future vision",day1-main-002,Dubai's Next Decade: How the DLD is Building a Future-Proof Real Estate Icon,"Dubai real estate growth, DLD future vision, regulatory innovation, urban development models, PropTech integration","International real estate investors, developers, PropTech founders, and government officials interested in regulatory models for rapid urban development.","Establishes RealTimes as a source for high-level, strategic analysis of Dubai's market, attracting C-suite readership and generating significant pre-event SEO traffic on a globally relevant topic.","""Beyond the Horizon: How DLD's Regulatory Framework is Future-Proofing Dubai's Real Estate Against Global Volatility"" - focusing on policy innovation and long-term stability.","Director General of DLD, Senior DLD Official (presenting the future vision)","High-level relationship building with the host government's key real estate regulatory body, providing exclusive access to policy insights and enhancing RealTimes' credibility as a serious industry partner.","The 'Dubai Model': Exporting a Blueprint for Rapid, Regulated Urban Real Estate Development","Historical land use data, comparative analysis of global regulatory sandboxes, DLD's recent policy changes (e.g., fractional ownership, visa programs), interviews with local developers.","Creates a high-authority, evergreen piece of content that positions RealTimes as a thought leader on global urban policy and real estate economics, driving long-term organic search visibility.","The official launch of IPS Congress 2026, establishing the narrative of Dubai's global real estate leadership and future-proofing strategies. It is the definitive 'must-see' for understanding the host city's vision.",Live-tweet coverage during the cinematic and DLD remarks. Immediate post-session article summarizing key DLD announcements. Featured placement in the daily email newsletter and a dedicated LinkedIn video clip of the cinematic trailer.,"Secures RealTimes' position as the primary source for official DLD announcements and the overarching theme of the congress, driving high traffic and establishing authority from the outset.",Very High,"As the opening session, this sets the tone for the entire congress and provides the official perspective from the Dubai Land Department (DLD), making it essential for immediate, high-impact coverage.",
"day1-main-003|||Shaping 2030: AI, Cities & the New Urban Code|||Global leaders examine AI-powered investment, climate resilience, and wellness-driven design shaping future cities. Panel explores intersection of technology innovation and sustainable urban development.",day1-main-003,"AI, Climate, and the New Urban Code: Shaping the Future of Global Cities by 2030","AI in Real Estate, Climate Resilience, Urban Planning, Wellness-Driven Design, Sustainable Investment","PropTech investors, urban planners, city officials, real estate developers, and sustainability consultants.","Drives high organic traffic and establishes RealTimes as a primary authority on the convergence of AI, sustainability, and urban development, capturing pre-event delegate interest.","""The New Urban Code: How do we ensure AI-driven investment and design prioritize equitable access and climate resilience over pure efficiency and profit?""","Global leaders, AI-powered investment, wellness-driven design, sustainable urban development","Secures exclusive, high-profile interviews with global thought leaders, strengthening RealTimes' relationship with key industry influencers and providing unique, authoritative content.",The 'Climate-AI Nexus': Quantifying the ROI of Resilience in Future Urban Investment Models,"Global AI-powered investment flows into PropTech, Case studies of climate-resilient urban projects, Regulatory frameworks for 'smart' city data governance, Consumer demand for wellness-driven design metrics","Generates a data-driven, authoritative report that can be gated for lead generation, providing unique insights that solidify RealTimes' reputation for deep, forward-looking analysis.","The definitive session on how AI and climate tech are not just optimizing, but fundamentally rewriting the economic and social code of future cities, moving beyond incremental change to systemic transformation.","Promote heavily across all channels (newsletter, social, website banner). Target B2B distribution via partner networks (e.g., PropTech VCs, Urban Planning Institutes) to drive high-value delegate attendance.","Positions RealTimes as the essential guide to the future of urban development, attracting a high-level audience of investors and city planners, and maximizing media partner visibility.",Very High,"This main-stage session addresses the most critical, forward-looking themes—AI, climate, and urban development—making it essential for RealTimes to cover for authority and audience engagement.",
"day1-main-004|||Branded Living 3.0: Emotion, Identity & Investment|||How storytelling, design, and digital-first marketing transform branded homes into cultural and investment icons. Focus on emotional connection and brand positioning in premium residential markets.",day1-main-004,"Branded Living 3.0: Emotion, Identity, and the Future of Luxury Investment","Branded residences, emotional connection, luxury real estate investment, digital-first marketing, PropTech","Luxury real estate developers, high-net-worth investors, brand strategists, PropTech innovators","Establishes RealTimes as a leading voice in the high-growth branded residences sector, driving high-value traffic and lead generation from key industry players.",The Architect of Desire: How to Translate Brand Identity into Tangible Real Estate Value and Emotional Connection,"CEO of a major branded residence developer, Global Head of Design for a luxury hospitality brand, Chief Marketing Officer of a digital-first real estate platform","Secures high-profile interviews, building direct relationships with industry leaders for future exclusive content and enhancing RealTimes' reputation for access.",The Tokenization of Identity: Fractional Ownership and the Digital Future of Branded Residences,"Analysis of global branded residence transaction volumes, case studies of successful digital-first marketing campaigns, expert interviews on emotional design in architecture, regulatory review of fractional ownership models","Generates a definitive, authoritative report that can be gated for lead capture, significantly boosting RealTimes' authority and data-driven content offerings.","The convergence of luxury branding, emotional design, and investment strategy in the post-pandemic residential market.","Targeted email campaign to RealTimes' premium subscriber list, LinkedIn campaign focused on luxury real estate and investment groups, and a dedicated feature on the IPS26 event page.","Positions RealTimes as the essential media partner for covering the intersection of luxury, brand, and PropTech, attracting high-value advertising and sponsorship interest.",Very High,"This session addresses the high-growth, high-margin branded residences sector, offering a strategic entry point for RealTimes to engage with top-tier developers and investors.",
day1-main-005|||Networking Lunch & Pavilion Exploration|||Light networking lunch and guided exhibitor tours. Strategic opportunity for PropertyTalents pipeline meetings.,day1-main-005,Maximize Your PropTech Event ROI: The Strategic Value of Networking Lunches,"PropTech Networking Strategy, Event ROI, Talent Acquisition in Real Estate Tech, Maximizing Exhibition Value","PropTech Founders, HR Directors, Business Development Managers, and Event Sponsors.","Drives high-intent traffic by addressing a common pain point (event ROI) and positions RealTimes as a strategic advisor, not just a news outlet.",Interview with a PropertyTalents executive on the future of PropTech recruitment and the specific roles they are scouting for at IPS26.,"PropertyTalents Executive, Key Exhibitor CEOs, PropTech HR Leaders","Establishes RealTimes as a key source for career and talent insights in PropTech, building relationships with major industry recruiters and exhibitors.",The Great PropTech Talent Shift: How AI and ESG are Reshaping Real Estate Tech Job Markets,"Analysis of 2025 PropTech funding rounds, emerging job roles in AI/Sustainability, comparison of global PropTech talent hubs, survey of executive hiring priorities","Provides deep, forward-looking analysis on the industry's most critical resource—talent—creating high-authority content that attracts C-suite readership.",The Unofficial Deal Flow: How Lunch & Pavilion Time Drives Business and Talent Acquisition at IPS26,"Live social media updates (LinkedIn, X) during the event, focusing on key meetings and exhibitor highlights. Post-event recap article on the value of unstructured networking.","Highlights the event's value beyond the stage, focusing on actionable business development and talent sourcing, which appeals directly to executive and HR audiences.",Medium,"While not a formal session, this time is crucial for B2B networking and talent acquisition, offering a unique angle on the event's strategic value.",
"day1-main-006|||PropTech Intelligence: From Data to Decisions|||From blockchain to predictive analytics — how data is reshaping risk assessment, ROI optimization, and transparency in real estate. Explores technology-driven decision-making in institutional investing.",day1-main-006,The Data Revolution: How AI and Blockchain are Reshaping Real Estate Investing,"Predictive Analytics in Real Estate, Blockchain for Property Transparency, Data-Driven ROI Optimization, Institutional PropTech Adoption","Institutional Investors, Asset Managers, Real Estate Fund Managers, PropTech Founders, Data Scientists.","Establishes RealTimes as a thought leader in institutional PropTech, driving organic search traffic from high-value keywords and generating leads for event coverage.","""The Algorithmic Investor: How Data Scientists are Replacing Traditional Portfolio Managers"" - Focus on the shift in required skillsets and the ethical/regulatory challenges of fully automated investment decisions.",Any speaker with a background in institutional investment or data science/AI development for real estate.,"Secures exclusive interviews with high-profile institutional decision-makers, providing unique, relationship-building content that attracts a senior-level audience.",The Tokenization Tipping Point: When Will Real Estate Become a Fully Liquid Digital Asset Class?,"Analysis of global PropTech funding in AI/Blockchain, case studies of successful data-driven portfolio exits, regulatory outlook on real estate tokenization, interview with a Chief Data Officer at a major REIT.","Creates a high-authority, evergreen content piece that serves as a long-term resource, boosting RealTimes' SEO ranking and credibility as a source of forward-looking market intelligence.","This session is the definitive guide to how institutional real estate investors are moving from gut-feeling to data-certainty, highlighting the immediate and future impact of AI and blockchain on portfolio management.",Promote via a dedicated email blast to institutional investor and asset manager segments. Use short video clips on LinkedIn and X (Twitter) targeting #RETech and #FinTech audiences. Feature prominently on the RealTimes event landing page.,"Positions RealTimes as the go-to source for serious, institutional-grade PropTech analysis, driving high-value traffic and strengthening relationships with key industry players.",High,"This session covers core PropTech themes—blockchain, predictive analytics, and data-driven institutional investing—making it highly relevant for our audience and a strong source of authority content.",
"day1-main-007|||Digital Twins for Net-Zero Cities|||Examines digital twin technology for smart planning and sustainability. Covers 3D city models, carbon footprint tracking, and climate resilience planning using emerging technologies.",day1-main-007,Digital Twins: The Blueprint for Net-Zero Cities and Climate Resilience,"Digital Twins, Net-Zero, Smart Cities, Climate Resilience, Carbon Tracking, 3D Modeling","Real estate developers, city planners, government officials, sustainability consultants, and PropTech investors.",High SEO value for 'Digital Twins' and 'Net-Zero' keywords; establishes RealTimes as the go-to source for the convergence of technology and sustainability in urban development.,Beyond the Hype: Practical ROI and Implementation Challenges of Large-Scale City Digital Twins,"Dr. Aisha Al-Mansoori, Eng. Omar Hassan, Ms. Sarah Chen","Establishes direct relationships with key innovators and decision-makers in government and technology, securing exclusive post-event content and future collaboration opportunities.",The Standardization and Monetization of City-Scale Digital Twin Data for Global Carbon Markets,"Comparative analysis of global digital twin platforms (e.g., NVIDIA Omniverse, Bentley Systems), case studies of carbon tracking in 3D models, regulatory frameworks for city data sharing, investment trends in climate-tech PropTech","Generates authoritative, data-driven content that attracts institutional investors and policy-makers, enhancing RealTimes' reputation for deep, forward-looking market intelligence.",The Unseen Infrastructure: How Digital Twins Are the Foundation for Dubai's Net-Zero Ambitions,Promote via a dedicated email campaign to C-suite and government contacts; feature prominently on the RealTimes homepage and in a pre-event LinkedIn campaign targeting sustainability and smart city groups.,"Positions RealTimes as a thought leader on the most advanced, high-impact PropTech solutions for climate change, driving high-quality traffic and securing future partnerships with city planning agencies.",Very High,"This session addresses the critical, high-value intersection of digital transformation and global climate goals, making it essential for a PropTech media platform like RealTimes to cover.",
day1-main-008|||Regulation & Reinvention: The DLD Innovation Forum|||DLD unveils Dubai's future-ready policy framework and AI governance strategy. Critical insight into regulatory environment for 2026 real estate market.,day1-main-008,Dubai's 2026 Real Estate: The New Regulatory Framework and AI Governance,"AI in real estate regulation, Dubai Land Department policy, PropTech governance, 2026 real estate market outlook","PropTech founders, institutional investors, real estate developers, legal and compliance professionals.",High SEO value for 'DLD' and 'AI regulation' keywords; establishes RealTimes as a thought leader on policy and future-of-real-estate topics.,Interview on the practical implementation challenges and timeline for the new AI governance framework in property transactions.,"Director General of DLD, Head of Innovation at DLD, Chief Legal Officer at DLD","Secures a high-level relationship with the key regulatory body (DLD), providing RealTimes with exclusive access and future-proofing content authority.",The Global Race for AI Governance in Real Estate: How Dubai's Framework Sets a New Standard,"Comparative analysis of Dubai's AI policy vs. Singapore/EU, impact assessment on property valuation models, case studies of DLD's current tech adoption","Creates a high-authority, evergreen piece of content that will be cited by industry professionals, driving long-term organic traffic and brand credibility.",Dubai's AI-Driven Regulatory Future: What the DLD Innovation Forum Means for Global PropTech Investment,"Targeted email campaign to C-suite and legal/compliance subscribers; featured placement on RealTimes homepage and social media channels (LinkedIn, X) with a focus on the 'exclusive insight' angle.","Positions RealTimes as the definitive source for regulatory and policy intelligence in the Middle East, attracting high-value, institutional readership and demonstrating media partner value to DLD.",Very High,"This session provides critical, forward-looking insight into the regulatory landscape and AI governance directly from the Dubai Land Department, which will shape the 2026 real estate market. This is essential, exclusive content for RealTimes' audience.",
"day1-main-009|||Clicks, Trust & Disruption: The Digital Recap|||Quick-fire takeaways on digital sales funnels, influencer marketing, and startup disruption. Day 1 summary session.

---",day1-main-009,"The Digital Funnel Revolution: Clicks, Trust, and PropTech Disruption in 2026","Digital Sales Funnels, PropTech Influencer Marketing, Startup Disruption, Customer Trust in Digital Channels","PropTech marketing executives, digital sales managers, startup founders, and real estate agents looking to modernize their sales process.",Drives high-intent organic traffic by targeting core industry pain points (digital sales and trust) and positions RealTimes as a source of pre-event strategic guidance.,"""Beyond the Click: How to Build Lasting Digital Trust in a Disrupted PropTech Market"" - focusing on ethical marketing and long-term customer relationships.","Digital Sales Funnel Expert, PropTech Influencer Marketing Strategist, Startup Disruption Analyst","Secures interviews with key opinion leaders, providing exclusive content that deepens relationships and positions RealTimes as a platform for industry thought leaders.",The Future of PropTech Digital Sales: From Funnel Optimization to Trust-Based Ecosystems,"Analysis of top 5 PropTech influencer campaigns, comparative study of sales funnel conversion rates (traditional vs. digital), forecast of regulatory impact on digital trust.","Creates evergreen, authoritative content that serves as a benchmark report, enhancing RealTimes' reputation for deep industry research and future-proofing strategies.","The definitive recap of Day 1's digital transformation insights, focusing on actionable strategies for sales funnels and market disruption.","Immediate post-event email newsletter to all RealTimes subscribers, featured banner on the website homepage, and a dedicated LinkedIn campaign targeting digital marketing professionals.","Establishes RealTimes as the go-to source for rapid, high-quality analysis of key event takeaways, driving immediate traffic and engagement.",High,"This session summarizes the key digital trends from Day 1, making it a high-value piece for immediate post-event analysis and future content planning.",
day1-institutional-001|||Panel: The Future of Work and Digital Economy|||Intersection of Technology Innovation and Human Skills in the digital economy. Focuses on workforce transformation and technology adoption in institutional real estate.,day1-institutional-001,The Digital Real Estate Workforce: Bridging the Tech-Talent Gap for 2026 Success,"Digital Transformation, Workforce Strategy, AI in Real Estate, Future of Work, Institutional Investment","Institutional Real Estate Investors, Asset Managers, PropTech Executives, HR and Strategy Leaders in Real Estate","Establishes RealTimes as a primary source for strategic analysis on real estate's digital future, driving organic search traffic and subscriber acquisition from high-value institutional readers.","""The Great Reskilling: How are you bridging the gap between legacy real estate skills and the demands of the digital economy, and what is the role of the C-suite in driving this cultural change?""","CTOs, Heads of HR, Institutional Portfolio Managers, PropTech Founders","Builds direct relationships with high-level institutional and technology leaders, securing future exclusive content and positioning RealTimes as a trusted media partner for executive insights.",The 'Invisible' Cost of Digital Transformation: Quantifying the ROI of Human Capital Investment in Institutional Real Estate,"Global real estate job market data, PropTech investment trends, AI adoption rates in property management, case studies of successful real estate reskilling programs, regulatory impact on remote work","Generates a highly authoritative, data-driven piece that will be cited by industry professionals, boosting RealTimes' SEO authority and credibility in the institutional sector.",Position the session as the definitive discussion on how institutional real estate firms must restructure their workforce and tech stack to remain competitive in the digital economy. Focus on the long-term strategic implications of skill gaps and AI adoption.,"Targeted email campaign to RealTimes' institutional investor and C-suite database. Dedicated social media push on LinkedIn and X (formerly Twitter) with a focus on 'Future of Work' and 'PropTech' hashtags. Post-event, feature the session prominently in a dedicated 'Best of Day 1' newsletter.","Reinforces RealTimes' position as a thought leader on the strategic, not just tactical, challenges facing institutional real estate. Drives high-value traffic and provides actionable intelligence to premium subscribers.",Very High,"This session addresses the fundamental shift in real estate's operational core—the intersection of technology and human capital—making it a critical, high-interest topic for institutional investors and operators.",
