Subject,Session ID,Thought Leadership Title,Thought Leadership Themes,Thought Leadership Audience,Thought Leadership Value,Speaker Spotlight Angle,Speaker Spotlight Targets,Speaker Spotlight Value,Trend Analysis Topic,Trend Analysis Components,Trend Analysis Value,Event Positioning Angle,Event Positioning Distribution,Event Positioning Value,Coverage Priority,Coverage Rationale,Error
day1-institutional-002|||Dubai 2033: Capital at the Speed of Light|||Dubai's vision to become the world's fastest capital execution hub. Strategic positioning for institutional capital flows and competitive advantage in global markets.,day1-institutional-002,Dubai's 2033 Vision: Accelerating Institutional Capital in the Global PropTech Hub,"Institutional Capital Flow, Regulatory Innovation, Global Market Competitiveness, PropTech Ecosystems, Future of Urban Investment","Global institutional investors, sovereign wealth funds, private equity firms, and PropTech founders seeking capital.","Generates high-quality, top-of-funnel traffic from a highly valuable institutional audience, establishing RealTimes as a thought leader in global real estate finance and future city development.","""Beyond the Horizon: How Dubai's Regulatory and Technological Frameworks are Accelerating Global Capital Deployment."" Focus on the practical mechanisms and policy shifts enabling this ""speed of light"" execution.","Director General of Dubai Land Department, CEO of a major sovereign wealth fund, Head of Global Real Estate for a top-tier institutional investor.","Secures high-level interviews with key decision-makers, building long-term relationships and providing exclusive, authoritative content that validates RealTimes' industry access.",The 'Capital Velocity' Index: Measuring and Forecasting the Speed of Institutional Investment in Emerging Global Hubs,"Analysis of recent Dubai regulatory changes (e.g., visa, ownership laws), comparison of capital execution speed metrics with Singapore and London, deep-dive into Dubai's PropTech funding rounds (2024-2025), and a forecast of institutional capital allocation by 2030.","Creates a proprietary, data-driven piece of content that becomes a benchmark resource, boosting RealTimes' authority and SEO ranking for critical industry terms like 'capital execution' and 'global investment hubs.'","This session is the anchor for Day 1's institutional track, framing the entire event's discussion on global capital flow and future-proofing investment strategies. It positions Dubai not just as a host, but as a future-forward investment model.","Targeted email campaign to institutional investor lists, dedicated social media push (LinkedIn/X) with a focus on the ""2033"" timeline, and a prominent feature on the RealTimes event landing page. Post-event, distribute the recorded session as a premium asset.","Establishes RealTimes as the definitive source for understanding the strategic future of PropTech capital, driving high-value traffic and demonstrating media partner relevance to institutional attendees.",Very High,"This session is central to the event's location and theme, directly addressing institutional capital, a key RealTimes audience. It offers high-impact, forward-looking content for immediate pre-event engagement.",
"day1-institutional-003|||The Capital Compass: CIO Outlook & Liquidity Flows|||CIOs discuss interest rates, liquidity shifts, and capital flows defining 2026 and beyond. Strategic outlook on institutional capital deployment.",day1-institutional-003,"CIO Outlook 2026: Navigating Interest Rates, Liquidity, and Capital Flows","Institutional Capital Flows, Interest Rate Impact on Valuations, Global Liquidity Shifts, Strategic Asset Allocation 2026","Institutional Investors (Pension Funds, Sovereign Wealth, Endowments), Fund Managers, Real Estate Private Equity, and High-Net-Worth Individuals.","High SEO value for terms like ""CIO Outlook 2026"" and ""Institutional Capital Flows."" Positions RealTimes as an essential resource for pre-event strategic planning, driving early engagement.","""The CIO's Crystal Ball: How Geopolitical Risk is Re-Pricing Global Real Estate Portfolios"" - focusing on the non-traditional risks and their immediate impact on capital allocation.","CIOs, Global Heads of Real Estate, Chief Strategists","Secures high-level executive interviews, building relationships with key decision-makers who are critical for future content and partnership opportunities. Provides exclusive, forward-looking content.",The 'Liquidity Trap' in Commercial Real Estate: Will Private Credit Fill the $1 Trillion Gap in 2026?,"Analysis of 5-year T-bond yield forecasts, tracking of major sovereign wealth fund real estate allocations (Q3/Q4 2025), comparison of debt-to-equity ratios in major PropTech funding rounds.","Generates a data-driven, authoritative piece that leverages technical financial analysis, appealing to a sophisticated audience and boosting RealTimes' credibility as a source of deep market intelligence.","The definitive macro-economic forecast for institutional real estate in 2026, setting the stage for all investment discussions at the Congress.","Promote heavily across LinkedIn and direct email to CIO/CFO lists. Live-tweet key quotes and data points. Post-event, create a short video summary for YouTube and the RealTimes homepage.","Establishes RealTimes as the go-to source for high-level, strategic financial insight, driving high-value traffic and positioning us as a thought leader among institutional investors.",Very High,"This session addresses the most critical macro-economic factors (interest rates, liquidity, capital flows) directly impacting institutional real estate investment in 2026 and beyond, making it essential for a PropTech media platform's core audience.",
day1-institutional-004|||Global Capital Allocation Index Premiere|||Launch of the world's first allocation benchmark for institutional capital flows. New institutional measurement standard for real estate allocation.,day1-institutional-004,New Global Index: How Institutional Capital Will Redefine Real Estate Allocation,"Institutional capital flows, Global Capital Allocation Index, real estate portfolio strategy, new investment benchmarks, risk-adjusted returns","Institutional investors, pension fund managers, sovereign wealth funds, asset allocators, and real estate investment strategists.","Generates high-intent organic traffic by addressing a critical pain point (capital allocation) with a new, authoritative data source, positioning RealTimes as a thought leader.",The methodology and future implications of the Global Capital Allocation Index: How will it change portfolio construction and risk assessment for institutional real estate?,"Head of Research at the Index Creator, Chief Investment Officer (CIO) of a major pension fund, Global Head of Real Estate Allocation","Secures exclusive interviews with key figures behind a new global standard, enhancing RealTimes' authority and building relationships with influential institutional leaders.",The Future of Institutional Real Estate Allocation: Beyond Traditional Benchmarks and Towards Predictive Modeling,"Analysis of historical capital flow data, comparison with existing allocation models, interviews with leading economists, regulatory impact assessment, technology's role in data standardization","Creates a high-value, evergreen resource that demonstrates deep market understanding and analytical rigor, boosting RealTimes' SEO and industry authority.",Highlighting the session as the launchpad for the new global standard that will redefine institutional real estate investment and portfolio strategy.,Targeted email campaign to institutional investors and asset managers; dedicated social media push on LinkedIn; featured placement on the RealTimes homepage and IPS event coverage hub.,"Establishes RealTimes as the primary source for breaking news and analysis on new global investment standards, driving high-value traffic and media partner visibility.",Very High,"This session introduces a new, globally relevant benchmark for institutional real estate capital, making it a critical, high-authority topic for RealTimes' audience.",
"day1-institutional-005|||Tokenization Unlocked: REITs, Liquidity & Digital Vehicles|||How tokenization transforms REITs and fund formation for liquidity and scale. Covers blockchain-based real estate investment vehicles and their institutional applications.",day1-institutional-005,Tokenized REITs: The Future of Real Estate Liquidity and Institutional Investment,"Real Estate Tokenization, Digital REITs, Blockchain Fund Formation, Institutional Liquidity, PropTech Finance","Institutional investors, REIT executives, real estate fund managers, and financial regulators.","Establishes RealTimes as a thought leader in institutional PropTech finance, attracting high-value traffic from financial professionals and generating leads for event registration.",The Regulatory Tightrope: How to structure a tokenized REIT that satisfies global securities laws while maximizing digital liquidity and cross-border investment appeal.,"[Assume Speaker 1 Name], [Assume Speaker 2 Name], [Assume Speaker 3 Name]","Secures exclusive content from key institutional players, building relationships with high-profile speakers who are actively navigating complex regulatory and financial structures in the digital asset space.",The Global Regulatory Race: Which jurisdiction will dominate the tokenized real estate market by 2030?,"Comparative analysis of US vs. EU tokenization regulations, case studies of successful tokenized fund launches, 5-year projection of tokenized real estate AUM, interview with a blockchain securities lawyer","Generates high-authority, evergreen content that is highly searchable and citable, solidifying RealTimes' reputation as a source for forward-looking, data-driven analysis in the PropTech sector.","This session is the definitive deep-dive into how blockchain technology is fundamentally restructuring institutional real estate investment, moving beyond hype to practical application in fund formation and liquidity management.",Promote heavily across LinkedIn targeting institutional investors and fund managers. Feature in the RealTimes daily newsletter as a 'Must-Attend' for finance professionals. Create a short video clip for Twitter/X and Instagram highlighting the key speakers and the topic's disruptive potential.,"Positions RealTimes as the authority on the intersection of institutional finance and PropTech, driving high-value registrations and demonstrating media partnership value by highlighting a core, high-level financial topic.",Very High,"Tokenization is a critical, high-impact topic bridging traditional institutional finance (REITs, funds) with cutting-edge PropTech (blockchain, digital vehicles), making it essential for RealTimes' institutional audience.",
"day1-institutional-006|||Capital Connections & Giga-Project Spotlight|||Institutional networking working lunch with presentation of mega-project investment opportunities, digital-twin visualizations, and projected ROI metrics.",day1-institutional-006,Digital Twins & ROI: The Future of Mega-Project Investment in Dubai,"Mega-project investment, Digital twins, Projected ROI, Institutional capital, Dubai PropTech","Institutional Investors, Sovereign Wealth Funds, PropTech VCs, Real Estate Developers","Establishes RealTimes as a source for high-level analysis on the intersection of digital technology and large-scale capital deployment, driving pre-event registration and SEO authority.",How digital twin technology is fundamentally de-risking and accelerating the capital deployment cycle for multi-billion dollar developments.,"Lead presenter from the mega-project development firm, Head of Digital Transformation from a major institutional investor, Senior Partner from a global real estate consultancy","Secures high-profile interviews that provide exclusive, actionable insights for our institutional audience, enhancing our reputation and building direct relationships with key industry decision-makers.",The 'Digital Twin Dividend': Quantifying the ROI Multiplier for Giga-Project Investment,"Analysis of 5-year projected ROI metrics for 3 major Dubai mega-projects, comparison of digital twin adoption rates in MENA vs. global markets, case studies on capital efficiency gains from digital twins","Generates a data-rich, authoritative report that becomes a cornerstone piece of content, attracting high-quality backlinks and establishing RealTimes as the definitive voice on PropTech investment metrics.","The definitive nexus for institutional capital seeking high-yield, tech-enabled mega-project opportunities in the MENA region.",Targeted email campaign to institutional investor lists; LinkedIn promotion focused on C-suite real estate and finance executives; dedicated feature on the RealTimes homepage.,"Positions RealTimes as the essential media partner for high-value deal flow and exclusive investment insights, strengthening relationships with institutional advertisers and event organizers.",Very High,"This session directly addresses the convergence of institutional capital, mega-projects, and cutting-edge PropTech (digital twins), making it a critical, high-value topic for our core audience.",
"day1-institutional-007|||Investor Protection Playbook: Structuring Trust & Funds|||Legal and regulatory tools for building institutional-grade trust structures and fund security. Covers fund governance, investor protection mechanisms, and compliance frameworks.",day1-institutional-007,De-Risking Digital Real Estate: The Future of Fund Governance and Investor Trust,"Fund Governance in PropTech, Investor Protection Mechanisms, Digital Asset Compliance, Cross-Border Regulatory Frameworks, Institutional Trust Structures","Institutional investors (pension funds, endowments), fund managers, legal and compliance professionals in the real estate and PropTech sectors.","Establishes RealTimes' authority in the complex intersection of finance, law, and technology, driving high-quality organic traffic from institutional audiences and generating leads for premium content.","""The Global Regulatory Maze"": How different jurisdictions (Dubai, Singapore, London) are adapting fund governance to the speed and complexity of digital real estate assets.","Chief Legal Officers of major PropTech funds, Heads of Regulatory Compliance at global asset managers, Senior Partners at international law firms specializing in fund formation.","Secures high-level interviews with key decision-makers, building long-term relationships for exclusive content and establishing RealTimes' access to top-tier industry expertise.",The Tokenization Tsunami: How Digital Assets are Forcing a Global Overhaul of Investor Protection and Fund Security Laws,"Analysis of recent global regulatory changes (e.g., MiFID II, SEC rules), comparative study of fund structures (REITs vs. tokenized funds), deep dive into AI's role in compliance monitoring and fraud detection.","Provides a forward-looking, exclusive analysis that differentiates RealTimes from competitors, attracting sophisticated readers and solidifying its reputation for deep, predictive industry insight.","The definitive guide to de-risking PropTech investments for institutional LPs, focusing on the legal architecture of trust and fund security.",Targeted email campaign to institutional investors and legal/compliance professionals; promoted posts on LinkedIn and X (formerly Twitter) using relevant regulatory and finance hashtags.,"Positions RealTimes as the go-to source for institutional-grade PropTech insights, driving high-value B2B engagement and media partner credibility with financial institutions.",Very High,"This session addresses the critical and timely issue of institutional trust and regulatory compliance, which is essential for attracting large-scale capital into PropTech and real estate. The content generated will establish RealTimes as a thought leader in the complex legal and financial aspects of the industry.",
"day1-institutional-008|||AI-Powered Alpha: Quant & Machine-Driven Underwriting|||How AI enhances risk modeling, yield optimization, and alpha generation in institutional underwriting. Covers machine learning applications in real estate investment analysis.",day1-institutional-008,The Algorithm Advantage: How AI is Redefining Real Estate Underwriting and Alpha,"AI in Real Estate Investment, Algorithmic Risk Modeling, Alpha Generation with Machine Learning, Future of Underwriting","Institutional Investors, Real Estate Fund Managers, Quantitative Analysts, PropTech Founders focused on FinTech.",High SEO value on a trending topic; establishes RealTimes as a leader in PropTech investment analysis; drives lead generation from institutional subscribers.,"""The Human-AI Partnership: How Quant Underwriters are Evolving Their Roles, Not Replacing Them"" - focusing on the new skill sets and strategic thinking required.","Dr. Anya Sharma (Head of Quant Strategy), Michael Chen (CIO, Tech-Focused RE Fund)","Builds relationships with key industry innovators and provides exclusive, forward-looking career advice for our professional audience.",The 'Black Box' Problem: De-risking and Explaining AI-Driven Real Estate Investment Decisions,"Comparative analysis of 5 major AI risk models, case studies of funds using ML for yield optimization, regulatory outlook on algorithmic investment, interview with a PropTech AI developer","Creates a high-authority, evergreen resource that addresses the primary skepticism around AI adoption, driving long-term traffic and credibility.","Highlight the session as the definitive guide to the practical, immediate applications of AI in real estate investment, moving beyond theoretical discussions.",Targeted email campaign to institutional investor list; LinkedIn promotion with key takeaways; dedicated feature on the RealTimes homepage for the week leading up to the event.,"Positions RealTimes as the go-to source for actionable, cutting-edge investment technology insights, driving high-quality institutional attendance to the session.",Very High,"AI in institutional real estate underwriting is a critical, high-value topic for our core audience, offering deep insights into future investment strategies and risk management.",
"day1-institutional-009|||Velocity is the New Alpha: Executing at the Speed of Capital|||How execution speed defines the competitive edge in modern markets. Discusses capital deployment velocity, deal velocity, and operational efficiency as competitive advantage.",,,,,,,,,,,,,,,,,
"day2-main-001|||Smart Blueprints, Green Returns: Building Sustainable Projects|||Developers share how analytics, design, and sustainability drive project success. Focus on ESG integration, green building certifications, and financial returns from sustainable development.",,,,,,,,,,,,,,,,,
"day2-main-002|||Global Brands, Local Roots|||Examines branding and positioning for scaling real estate companies regionally. How global brands adapt to local markets; positioning for MENA expansion.",day2-main-002,Global Real Estate Branding: Scaling Strategies for Local MENA Markets,"Global branding, local adaptation, real estate positioning, MENA market expansion, cultural nuance in marketing","Global real estate executives, marketing directors, brand strategists, investors targeting the Middle East and North Africa (MENA) region.","Establishes RealTimes as a source for high-level strategic guidance on international real estate brand management and regional market entry, driving C-suite readership.",The cultural and regulatory tightrope: How global real estate brands successfully navigate local compliance and consumer trust in the MENA region.,"CMOs of global real estate firms, Regional Heads of Marketing for major developers, Brand Consultants specializing in the MENA market","Secures exclusive, high-value interviews with influential brand leaders, strengthening relationships with key industry figures and providing unique content for our audience.",The Future of 'Glocal' Real Estate: Predicting the Next 5 Years of Brand Localization and Digital Positioning in Emerging Markets,"Analysis of recent global real estate brand failures/successes in MENA, case studies on effective cultural integration in marketing, data on regional consumer brand loyalty and trust metrics","Generates highly authoritative, data-driven content that attracts a technical and strategic audience, boosting RealTimes' SEO ranking for 'real estate branding' and 'MENA market strategy.'",This session is crucial for understanding the strategic blueprint for global real estate firms looking to capitalize on the rapid development and investment opportunities in the MENA region.,"Promote via a dedicated email blast to our 'Global Strategy' subscriber segment, LinkedIn campaign targeting C-level executives, and a feature on the RealTimes homepage event hub.",Positions RealTimes as the essential media partner for strategic insights into market entry and brand success in high-growth regional markets like Dubai.,High,"This session addresses the critical and complex challenge of brand localization for global real estate players, a topic of high interest to our executive readership focused on MENA expansion.",
day2-main-003|||Networking Lunch & Pavilion Exploration|||Networking lunch and exhibitor engagements. Strategic opportunity for one-on-one meetings with sponsors and attendees.,day2-main-003,Beyond the Panel: How to Master Strategic Networking at IPS Congress 2026,"Strategic networking, Deal-making at conferences, Sponsor engagement, Unscripted business opportunities, PropTech investment trends","PropTech founders, institutional investors, real estate developers, and C-suite executives attending the congress.","Establishes RealTimes as a strategic resource for high-value attendees, driving pre-event engagement and demonstrating an understanding of the business objectives behind conference attendance.",The Art of the PropTech Deal: How to Maximize Your 60-Minute Networking Window,"High-profile sponsors, Key attendees, Exhibition organizers","Provides actionable advice for attendees on maximizing their networking time, enhancing the overall event experience. Creates goodwill with sponsors by featuring their presence and engagement.",The Hidden Economy of PropTech Conferences: Quantifying the Value of Unscripted Networking and Pavilion Deals,"Analysis of past IPS Congress deal flow, Sponsor-attendee meeting data (if available), Post-event survey on networking success, PropTech M&A data for Q1/Q2 2026","Creates a high-authority, data-driven piece that quantifies the ROI of event attendance, appealing to a sophisticated, business-minded audience and generating significant SEO value.",The Unscripted Congress: Where Real Deals Are Made Over Lunch and Handshakes,Targeted pre-event email to registered attendees and sponsors. Live social media coverage (Twitter/LinkedIn) with candid photos and quotes from the pavilion floor using #IPSDubaiDeals. Post-event summary of key connections made.,"Positions RealTimes as the media partner that understands the true value of the event lies in the business connections, not just the stage presentations. Offers tangible value to sponsors by highlighting their engagement opportunities.",Medium,"While not a formal session, this time slot is crucial for deal-making and relationship building, offering a unique angle on the business side of the congress.",
"day2-main-004|||Women's Empowerment Forum: Breaking Barriers & Building Futures|||Inspiring female leaders discuss finance, resilience, negotiation, and recognition in real estate. Focus on women entrepreneurs, leaders, and builders in the industry.",day2-main-004,The Future is Female: PropTech's Path to Gender Parity and Innovation,"Gender parity in PropTech, Female entrepreneurship, Real estate finance, Negotiation strategies, Resilience in leadership","PropTech founders, Real estate executives, Investors, HR/Talent acquisition professionals","Establishes RealTimes as a champion for diversity and a source for forward-thinking business strategy, driving high-value traffic from a key demographic (female leaders and allies).","""The Unwritten Rules of Real Estate Finance: How Female Founders are Securing Capital and Scaling Their Ventures""","[Target Speaker 1 Name], [Target Speaker 2 Name], [Target Speaker 3 Name]","Facilitates direct engagement with high-profile female leaders, strengthening RealTimes' network and securing exclusive, high-value content for future features.",Quantifying the ROI of Gender Diversity: The Economic Case for Female Leadership in PropTech Investment,"Global gender pay gap data in real estate, VC funding trends for female-led PropTech, Impact of board diversity on REIT performance, Case studies of successful female-led PropTech exits","Generates highly authoritative, data-driven content that attracts institutional investors and C-level executives, boosting RealTimes' reputation for deep market intelligence.",This forum is the definitive platform for discussing the economic imperative of gender diversity and the tangible strategies for female leadership in the global real estate and PropTech sectors.,Pre-event promotion via LinkedIn and email to C-suite and HR lists. Live coverage on X (Twitter) and Instagram stories. Post-event video clips and a dedicated feature article on the RealTimes website.,"Positions RealTimes as a media partner committed to social impact and industry evolution, attracting a diverse and influential audience segment.",Very High,"This session addresses a critical, high-visibility topic (gender equality) and features influential leaders, offering significant opportunities for thought leadership and networking.",
