Subject,Session ID,Thought Leadership Title,Thought Leadership Themes,Thought Leadership Audience,Thought Leadership Value,Speaker Spotlight Angle,Speaker Spotlight Targets,Speaker Spotlight Value,Trend Analysis Topic,Trend Analysis Components,Trend Analysis Value,Event Positioning Angle,Event Positioning Distribution,Event Positioning Value,Coverage Priority,Coverage Rationale,Error
"day2-main-005|||Designing Experiences: Hospitality Meets Community|||The intersection of lifestyle, hospitality, and sustainable living. How mixed-use development and hospitality services enhance community value and resident experience.",day2-main-005,The Rise of 'Resi-pitality': Blending Hospitality and Residential for Community Value,"Mixed-use development, hospitality-as-a-service, community value, sustainable living, resident experience, PropTech integration","Real estate developers, institutional investors, urban planners, and PropTech innovators focused on residential and mixed-use assets.","Generates high-quality, evergreen content that captures search traffic for 'mixed-use development' and 'hospitality-led design,' establishing RealTimes as a definitive source on next-gen urban living.","""The Service-First City: How does the integration of hospitality management into residential assets fundamentally change the developer's business model and the resident's expectation of 'home'?""","[Placeholder: Head of Mixed-Use Development at Emaar], [Placeholder: CEO of a Sustainable Hospitality Group], [Placeholder: Urban Design Lead at Gensler]","Secures exclusive interviews with influential figures at the forefront of mixed-use and hospitality-driven development, fostering relationships for future content and partnership opportunities.",The 'Resi-pitality' Model: Quantifying the ROI of Integrated Hospitality Services in Residential Real Estate,"Case studies of successful 'resi-pitality' projects, data on resident retention/satisfaction in service-led communities, analysis of PropTech tools enabling seamless service delivery, regulatory hurdles for mixed-use zoning","Creates a data-driven, authoritative report that can be gated for lead generation, providing a benchmark for industry professionals on the financial and social returns of service-led communities.","This session is critical for understanding the future of urban living, moving beyond mere functional design to focus on holistic, service-driven community creation that drives property value and resident retention.","Targeted outreach to real estate developers, urban planners, and hospitality investment firms via LinkedIn and industry newsletters. Promote on-site with QR codes linking to a post-session summary article.","Positions RealTimes as a key voice in the convergence of PropTech, hospitality, and urban planning, demonstrating an understanding of value creation beyond traditional real estate metrics.",High,"This session addresses the highly relevant and growing trend of mixed-use developments and the integration of hospitality-grade services into residential and community spaces, offering a strong angle for thought leadership and trend analysis.",
"day2-main-006|||Women Who Build the Future: Inclusion & Resilience|||Women brokers and developers lead resilient, inclusive markets. Focus on female leadership, operational resilience, and market inclusion strategies.",day2-main-006,Female Leadership: The New Blueprint for Resilient & Inclusive Real Estate Markets,"Female leadership in real estate, market resilience, operational inclusion strategies, PropTech's role in diversity, sustainable market growth","Real estate developers, brokers, investors, PropTech founders, and corporate diversity and inclusion officers.","Establishes RealTimes as a thought leader on DEI and market stability, capturing high-value search traffic from professionals researching leadership and future-of-work trends.","""Beyond the Glass Ceiling: How Female Leaders are Redefining Operational Resilience and Market Access in Global Real Estate.""","Prominent female brokers, PropTech founders, and real estate developers on the panel (e.g., Sarah Al-Amiri, Aisha Khan, Dr. Elena Petrova)","Secures exclusive content, builds strong relationships with influential female leaders, and provides a human-interest angle that drives social media engagement.",The Economic Impact of Gender Parity in Real Estate: Quantifying Resilience and Investment Returns,"Global data on female-led real estate firm performance, case studies of successful inclusion policies, analysis of PropTech tools that reduce market barriers, expert interviews on future regulatory trends","Generates a high-authority, data-driven asset that is highly shareable and citable, boosting RealTimes' credibility as a source for serious market analysis.",Highlighting the session as the definitive platform for discussing the future of diverse leadership in real estate and its direct link to market stability and growth.,"Promote heavily across LinkedIn and industry newsletters targeting C-suite executives and HR/DEI leaders; feature in a dedicated ""Leadership & Inclusion"" track preview on the RealTimes website.","Positions RealTimes as a champion of diversity and a source for forward-thinking leadership content, driving high-quality delegate attendance to the event.",Very High,"This session addresses critical, high-impact themes of diversity, leadership, and market resilience, which are key drivers of modern PropTech and appeal to a broad, influential audience.",
"day2-main-007|||Agents of Influence: SuperApps & Branding Mastery|||Explores super-platforms transforming agent efficiency and digital branding. Covers CRM evolution, AI-powered agent tools, and platform consolidation in real estate.",day2-main-007,The SuperApp Revolution: How AI and Platform Consolidation are Redefining the Real Estate Agent,"SuperApps, Agent Efficiency, Digital Branding, CRM Evolution, AI in Real Estate, Platform Consolidation","Real estate agents, brokerage owners, PropTech founders, venture capitalists, and marketing professionals.",Captures high-intent organic search traffic (SEO) by addressing a major industry pain point and provides a foundational understanding of the session's core themes.,"""The Platform Paradox"": How do you balance the efficiency of a SuperApp with the need for personalized, human-centric client relationships?","Global Head of Product at a major PropTech SuperApp, CEO of a leading real estate franchise, Chief Digital Officer of a major brokerage.","Secures exclusive, high-profile interviews that offer unique perspectives on a polarizing topic, enhancing RealTimes' reputation for deep industry access and thought leadership.",The 'Walled Garden' Effect: Analyzing the Long-Term Impact of SuperApp Dominance on Agent Autonomy and Data Ownership,"Comparative analysis of global SuperApp adoption rates, 5-year forecast for agent tool market share, regulatory impact assessment on data ownership and privacy.","Establishes RealTimes as an authoritative source by providing proprietary, forward-looking market intelligence that goes beyond the session's immediate scope.",The definitive guide to the new real estate ecosystem: how SuperApps are forcing agents to evolve from independent operators to platform masters.,Targeted email campaign to C-suite and VPs of Brokerages/Tech Firms; dedicated social media push on LinkedIn and X; featured placement on RealTimes homepage and IPS event hub.,"Positions RealTimes as the essential source for understanding the future of agent technology and market structure, driving high-quality event registration and media partnership value.",Very High,"This session addresses the critical and immediate industry shift towards platform consolidation and AI-driven agent tools, offering high-value, actionable insights for a broad professional audience.",
"day2-main-008|||Unicorn Builders: Resilient Startups & Founders to Watch|||Startup founders share real-world growth and resilience journeys. Focus on profitable growth, unit economics, and founder resilience in market downturns.",day2-main-008,The Resilient Unicorn: How PropTech Founders Master Profitable Growth in a Downturn,"Profitable Growth, Unit Economics, Founder Resilience, Market Downturn Strategy, Sustainable PropTech","Venture Capitalists, Angel Investors, Established PropTech CEOs, and Real Estate Developers seeking investment opportunities.",Drives significant organic traffic and establishes RealTimes as a leading authority on PropTech investment and sustainable startup strategy.,"""Beyond the Hype: What hard-won lessons on unit economics and capital efficiency are non-negotiable for survival and future growth?""","[Founder 1 Name], [Founder 2 Name], [Founder 3 Name]","Establishes direct relationships with influential, resilient founders, securing exclusive post-event content and potential future partnerships.",The 'Profitability Premium': Analyzing the Valuation Shift from Revenue Growth to Unit Economics in PropTech,"Q3/Q4 2025 PropTech funding data, analysis of public PropTech company unit economics, founder sentiment survey, case studies of successful pivots.","Generates a high-authority, data-driven report that can be gated for lead generation and cited by industry analysts, boosting RealTimes' credibility.","Highlighting the shift from 'growth at all costs' to 'profitable resilience' in PropTech, featuring founders who have successfully navigated market corrections.",Promote via a dedicated email campaign to the RealTimes investor list and a LinkedIn campaign targeting VCs and C-suite executives in the PropTech sector.,"Positions RealTimes as a platform that understands and promotes sustainable business models, attracting a high-quality, investment-focused audience to the event.",High,"This session directly addresses the current market focus on sustainable growth and founder resilience, providing high-value content for our core audience of investors and established PropTech leaders.",
"day2-institutional-001|||Cross-Border Real Estate: Global Access, Local Trust|||Explores digital regulation and fintech enabling remote property investment. How technology removes barriers to international real estate participation.",day2-institutional-001,Global Property Access: The Fintech and Regulatory Revolution in Cross-Border Real Estate,"Cross-border investment, Digital regulation, Fintech in real estate, Fractional ownership, Global access to property","Institutional investors, high-net-worth individuals, PropTech founders, and real estate fund managers.",Drives high-intent organic traffic from institutional and B2B audiences searching for insights on global investment and regulatory technology.,The regulatory tightrope: How to balance investor protection with the speed and scale of digital cross-border transactions.,"Global real estate fund managers, Fintech founders specializing in fractional ownership, Regulatory compliance officers, International tax lawyers","Secures high-level interviews with key industry players, building relationships for future exclusive content and positioning RealTimes as a hub for executive insights.",The Future of Digital Trust in Global Real Estate: From Blockchain to Regulatory Sandboxes,"Analysis of global regulatory sandboxes for PropTech, Growth projection of fractional real estate investment platforms, Case studies of successful cross-border digital transactions, Comparative analysis of trust mechanisms (blockchain vs. traditional escrow)","Generates a definitive, citable report that positions RealTimes as a primary source for forward-looking market intelligence and data-driven analysis.",The Digital Bridge: How Fintech and Regulation are Unlocking Trillion-Dollar Cross-Border Real Estate Markets,"Targeted email campaign to institutional investors and wealth managers; LinkedIn campaign focused on ""Global Investment"" and ""Digital Assets"" hashtags; Featured placement on RealTimes homepage.","Establishes RealTimes as the authority on the intersection of global finance, regulation, and PropTech, attracting a high-net-worth and institutional readership.",Very High,"This session addresses the critical, high-value trend of democratizing global real estate investment through PropTech and regulatory innovation, making it essential for a PropTech media platform's coverage.",
"day2-institutional-002|||Global Capital Expansion: The Dubai Continuum|||Outlines Dubai's strategic role in linking emerging markets to global capital flows. Positioning of Dubai as institutional capital hub connecting Europe, MENA, and Asia.",day2-institutional-002,"Dubai's Role in Global Capital: Connecting Europe, MENA, and Asia","Dubai as Capital Hub, Global Capital Flows, Emerging Markets Investment, PropTech in MENA","Institutional Investors, Sovereign Wealth Funds, Global Real Estate Developers, PropTech Founders","Establishes RealTimes as a thought leader on global capital movements and the strategic importance of Dubai, driving high-value traffic from institutional finance professionals.",The strategic and technological infrastructure required for Dubai to maintain and grow its position as a tri-continental capital gateway.,"Head of Institutional Investment at a major Dubai-based fund, Senior Executive from a global financial services firm with a MENA focus","Secures interviews with high-profile financial leaders, enhancing RealTimes' credibility and building relationships with key institutional players for future collaborations.",The Digital Silk Road: How PropTech is Enabling Dubai's Capital Flow Strategy,"Blockchain in cross-border transactions, tokenization of real estate assets, regulatory sandboxes for FinTech/PropTech, data security infrastructure","Generates authoritative, forward-looking content that attracts a technical and strategic audience, positioning RealTimes at the intersection of finance, technology, and real estate.",The definitive session for understanding the new global axis of institutional capital and the strategic imperative of a Dubai presence.,"Targeted email campaign to institutional investor lists, LinkedIn campaign with key financial hashtags, dedicated feature on the RealTimes homepage and newsletter.","Maximizes session attendance and highlights RealTimes' role in covering the most strategically important financial topics at IPS26, reinforcing media partner value.",Very High,"This session addresses the macro-economic theme of global capital flows and Dubai's central role, which is critical for RealTimes' institutional audience and aligns perfectly with the event's high-level strategic focus.",
day2-institutional-003|||The Asset Playbook: Digital + Real Synergy|||How digital assets and real markets co-exist to drive portfolio resilience. Blending tokenized assets with physical real estate in institutional portfolios.,day2-institutional-003,The Institutional Playbook: Blending Tokenized Assets for Real Estate Portfolio Resilience,"Real Estate Tokenization, Institutional Investment, Portfolio Resilience, Digital Assets, PropTech, Liquidity","Institutional investors, pension fund managers, sovereign wealth funds, and real estate private equity firms.","Generates significant SEO traffic from high-value institutional keywords, establishes RealTimes' authority in the convergence of finance and PropTech, and drives pre-event registration for the session.","""From Theory to Practice: How are you navigating the regulatory and technological hurdles to successfully blend tokenized and physical assets in a multi-billion dollar portfolio?""","Chief Investment Officer (CIO) of a major institutional fund, Head of Digital Assets at a global real estate manager","Secures exclusive, high-level insights from industry leaders, enhancing RealTimes' credibility and providing valuable content for relationship building with top-tier institutional speakers.",The Tipping Point: When Tokenized Real Estate Becomes a Liquidity Standard for Institutional Portfolios,"Global regulatory landscape for tokenized securities, comparative analysis of tokenization platforms, case studies of successful institutional tokenization, projected market size by 2030","Provides a deep, data-driven analysis that serves as a valuable resource for industry professionals, boosting RealTimes' authority and long-term search engine ranking for ""tokenization"" and ""institutional real estate.""",The definitive guide to integrating tokenized real estate into traditional institutional investment strategies for enhanced portfolio resilience and liquidity.,Promote heavily across LinkedIn and institutional investor newsletters. Use targeted ads on financial news sites. Feature as a lead story in the daily IPS 2026 email digest.,"Establishes RealTimes as the go-to source for institutional PropTech insights, driving high-value B2B traffic and demonstrating media partner value by highlighting a key institutional track session.",Very High,"This session addresses the critical, forward-looking intersection of digital assets and institutional real estate, which is a high-value topic for RealTimes' core audience and positions us as a thought leader.",
"day2-institutional-004|||Allocating Beyond Borders: Designing for Diversification|||Discusses cross-jurisdictional fund design, tax efficiency, and yield optimization. How institutional investors structure diversified real estate allocations across geographies.",day2-institutional-004,Global Real Estate Fund Design: Mastering Tax Efficiency and Cross-Border Yield,"Cross-jurisdictional fund design, tax efficiency in real estate, global portfolio diversification, yield optimization strategies, institutional capital allocation","Institutional investors, pension fund managers, sovereign wealth funds, real estate fund managers, and tax/legal advisors specializing in cross-border transactions.","Drives high-quality organic traffic from institutional investors searching for advanced fund structuring and tax strategy, positioning RealTimes as a source of deep, actionable financial intelligence.","""The Tax-Efficiency Tightrope: How shifting global tax regimes are forcing a radical redesign of cross-border real estate fund vehicles.""","Global Head of Real Estate Fund Structuring, Chief Investment Officer (CIO) of a Sovereign Wealth Fund, Partner at a Global Tax Advisory Firm","Secures high-level interviews with key decision-makers, fostering relationships with influential figures whose insights lend significant authority and credibility to RealTimes' coverage.",The Post-BEPS Future of Cross-Jurisdictional Real Estate Fund Structuring,"Analysis of recent OECD/BEPS tax changes, comparison of REIT vs. non-REIT cross-border structures, case studies of successful multi-jurisdictional fund launches, forecast of capital flows into emerging real estate markets","Creates a high-authority, evergreen piece of content that demonstrates deep industry knowledge and foresight, serving as a benchmark resource for the PropTech and institutional investment community.","The definitive guide to navigating global real estate fund structures, focusing on tax-efficient diversification and yield optimization in a complex geopolitical landscape.",Promote via a dedicated email to our 'Institutional Investor' segment. Feature prominently on the RealTimes homepage and LinkedIn with a focus on the 'tax efficiency' and 'cross-jurisdictional' keywords.,"Establishes RealTimes as the go-to source for sophisticated institutional investment strategy, driving high-value traffic and demonstrating media partner relevance to the most influential attendees.",Very High,"This session addresses the critical, high-value topic of cross-border institutional real estate investment, which is essential for our core audience of fund managers and institutional investors.",
"day2-institutional-005|||Outbound Capital Pathways: Europe · LATAM · Asia|||Practical clinics mapping regional investment corridors. Specific deep-dives on Europe-to-MENA, MENA-to-Asia, and other emerging corridors.",day2-institutional-005,"The New Global Capital Flow: MENA's Role in Connecting Europe, LATAM, and Asia","MENA investment corridors, cross-regional PropTech investment, emerging capital pathways, Europe-to-MENA real estate, Asia-LATAM capital flow","Institutional investors, sovereign wealth funds, global real estate developers, PropTech VCs, economic development agencies","Establishes RealTimes as a primary source for understanding the strategic shift in global real estate capital, driving high-quality traffic from institutional decision-makers.",The 'Corridor Architects': How are you de-risking and standardizing cross-regional PropTech investment and what is the 5-year outlook for the MENA-Asia capital bridge?,"Global Head of Real Estate at a major Sovereign Wealth Fund, CEO of a leading LATAM PropTech VC, Head of European Institutional Sales at a global asset manager","Secures high-level executive interviews, building relationships with key global capital allocators and providing exclusive, actionable insights for our institutional audience.",The 'New Silk Road' of Real Estate: Mapping the Digital and Physical Infrastructure Enabling MENA-Asia Capital Flow,"Sovereign wealth fund allocation data, PropTech investment volume by corridor, regulatory changes in cross-border investment, emerging market risk indices, infrastructure spending forecasts","Generates a definitive, data-driven report that serves as a long-term SEO asset, attracting research-focused institutional readers and cementing RealTimes' authority in global PropTech finance.",MENA as the Global Capital Bridge: Unlocking Trillion-Dollar Cross-Regional Real Estate Corridors,Targeted email campaign to institutional investor lists; dedicated LinkedIn campaign highlighting the session's exclusive content; live-tweet coverage with key quotes and data points.,"Drives high-value institutional attendance and reinforces RealTimes' authority on global capital market dynamics, directly supporting media partner value by showcasing exclusive content.",High,"This session addresses critical, high-value cross-border capital flows, positioning MENA as a central hub, which is a key strategic narrative for the event and our audience.",
day2-institutional-006|||Institutional Networking & Partnership Dialogue|||Facilitated B2B roundtables for allocators and fund managers. Structured networking with introduction protocol for deal origination.,day2-institutional-006,The Future of PropTech Deal Origination: Structured Networking in Dubai,"PropTech investment, institutional capital, deal origination, structured networking, B2B roundtables","Institutional investors, fund managers, PropTech founders, real estate private equity professionals","Establishes RealTimes as the go-to source for institutional investment strategy and deal flow, driving high-value traffic from key industry players.","""The Art of the Institutional Pitch: What Allocators Really Look for in a PropTech Fund Manager."" Focus on the 'introduction protocol' and successful deal-making strategies.","Lead Allocator from a major pension fund, Senior Fund Manager from a global real estate PE firm","Secures high-profile interviews with key decision-makers, building strong relationships that can lead to exclusive content and future collaborations for RealTimes.",The Rise of Protocol-Driven Deal Origination: How Structured Networking is Reshaping Institutional PropTech Investment,"Analysis of recent institutional capital deployment in PropTech (last 12 months), comparison of deal origination models (structured vs. organic), interview with a deal-flow consultant, case study of a successful B2B matchmaking platform.","Creates a definitive, data-backed resource on a critical industry shift, boosting RealTimes' SEO authority for terms related to PropTech investment and institutional deal-making.","Highlighting the session as the 'Deal Origination Hub' of IPS26, emphasizing the structured, protocol-driven approach to connecting allocators and fund managers for concrete outcomes.",Targeted email campaign to RealTimes' institutional investor and fund manager subscriber lists. Live social media coverage with quotes from participants (with permission). Post-event summary article.,"Positions RealTimes as the essential media partner for high-level, capital-intensive deal flow at IPS26, reinforcing our authority in institutional PropTech investment.",Very High,"This session is a direct, high-value B2B deal-making platform for institutional capital, which is a core audience for RealTimes and a key driver of industry news. Coverage offers immediate, actionable insights.",
